{
  "schemaVersion": 1,
  "id": "brick-breaker",
  "title": "Brick Breaker",
  "description": "Build a complete Brick Breaker game in Scratch 3. This self-guided course is for ages 10-14 with some Scratch experience. Across six chapters, you will control a paddle, move one Ball, create 50 bricks that each take two hits, drop Apple power-ups, track three lives, and end the game when every brick is gone.",
  "objectives": [
    "Use coordinates, loops, conditions, variables, costumes, clones, and broadcasts in Scratch 3.",
    "Build a reliable game loop in which miss detection happens before edge bouncing.",
    "Make Ball the only sprite that checks for touching a brick, and use `broadcast Hit Brick and wait` so exactly one Brick clone reacts.",
    "Create 50 bricks that always change from Healthy to Cracked before breaking.",
    "Use Lives and Bricks Left to produce clear lose and win states that reset only with the green flag.",
    "Test a multi-sprite project by checking one game rule at a time."
  ],
  "prerequisites": [
    "Know how to open Scratch 3 and start a new project.",
    "Know how to drag blocks together and choose values from block menus.",
    "Be able to rename sprites, costumes, backdrops, variables, and messages exactly as shown."
  ],
  "requirements": [
    "Use Scratch 3 in a browser or the Scratch 3 desktop app.",
    "Complete all six chapters in order; there are no optional branches.",
    "Plan for 90-120 minutes per chapter.",
    "Create exactly four sprites named Paddle, Ball, Brick, and Apple.",
    "Keep Ball as one original sprite and never create Ball clones.",
    "Create exactly 50 Brick clones in five rows of ten.",
    "Give every Brick clone the costumes Healthy and Cracked, in that order, so every brick requires two hits.",
    "Start each Apple clone by going to Ball. Ball is still paused by `broadcast Hit Brick and wait`, so the Apple appears where the brick broke.",
    "Create exactly three variables for all sprites named Lives, Bricks Left, and Hit Claimed, plus the Brick-only variable Is Clone.",
    "Create exactly six messages named Build Bricks, Start Ball, Hit Brick, Apple Caught, Win, and Game Over.",
    "Start every game with Lives set to 3, Bricks Left set to 50, and Hit Claimed set to 0.",
    "Have only the Stage send Build Bricks and Start Ball at startup: wait for Build Bricks to finish before sending Start Ball.",
    "Use Bricks Left, not score, to decide when the player wins.",
    "Use the green flag as the only way to start or restart the game."
  ],
  "vocabulary": [
    {
      "term": "coordinate",
      "meaning": "A number that describes a position. In Scratch, x moves left and right while y moves down and up."
    },
    {
      "term": "variable",
      "meaning": "A named place that stores a value the project can change and check."
    },
    {
      "term": "clone",
      "meaning": "A temporary copy of a sprite that uses the sprite's scripts but can move and act on its own."
    },
    {
      "term": "one sprite, no clones",
      "meaning": "A sprite that never makes copies of itself. Ball is one sprite with no clones, so \"go to Ball\" always means the same place."
    },
    {
      "term": "collision",
      "meaning": "An event that happens when two game objects touch."
    },
    {
      "term": "broadcast-and-wait",
      "meaning": "A message that pauses the sender until every script started by that message has finished."
    },
    {
      "term": "Hit Claimed",
      "meaning": "A shared variable that is 0 or 1. Ball sets it to 0 before a hit. The first Brick clone that reacts sets it to 1, so the other clones know the hit was already handled."
    },
    {
      "term": "script that finishes",
      "meaning": "A script that reaches its last block because it has no `forever` loop. `broadcast and wait` can only continue after every script it started has finished."
    },
    {
      "term": "game loop",
      "meaning": "A repeating script that updates movement, collisions, and game rules many times each second."
    },
    {
      "term": "state",
      "meaning": "The current condition of an object or game, such as Healthy, Cracked, playing, won, or lost."
    }
  ],
  "chapters": [
    {
      "id": "project-foundations",
      "title": "Project Foundations",
      "estimatedMinutes": 90,
      "objectives": [
        "Identify the complete game rules before coding.",
        "Create and name all required project parts.",
        "Control the Paddle with the mouse."
      ],
      "steps": [
        {
          "id": "observe-complete-game",
          "kind": "observe",
          "title": "Watch the Finished Game",
          "explanation": "Brick Breaker is easier to build when you separate what you see from the rules underneath it. The player moves a Paddle. One Ball travels continuously. A grid contains 50 bricks. Every brick survives its first hit by changing from Healthy to Cracked, then disappears on its second hit. Missing the Paddle costs one of three lives. The game is won only when Bricks Left reaches 0.",
          "instructions": [
            "Watch the example once without trying to copy code.",
            "Watch again and look for the Paddle, the one Ball, five rows of ten bricks, and falling Apples.",
            "Notice that a first brick hit changes its appearance and a second hit removes it.",
            "Notice that a miss removes a life instead of bouncing from the bottom edge.",
            "Remember that the green flag is the only start and restart control in the project."
          ],
          "hints": [
            "Count one row, then multiply ten bricks by five rows.",
            "The video shows behavior; the exact code is built in the following steps."
          ],
          "debuggingTips": [
            {
              "symptom": "The final game seems like too many parts to remember.",
              "checks": [
                "Say the four sprite names aloud: Paddle, Ball, Brick, Apple.",
                "Write down the two ending rules: Lives equals 0 loses, and Bricks Left equals 0 wins."
              ]
            }
          ],
          "checkpoint": {
            "task": "Describe the required game path before opening the editor.",
            "expectedResult": "You can explain the two-hit brick rule, the three-life rule, and the win rule without guessing.",
            "completeWhen": [
              "You know there will be exactly 50 bricks.",
              "You know there is only one Ball and it never makes clones.",
              "You know the green flag is the only restart."
            ]
          },
          "youtubeID": "wbfSNfJtPOo"
        },
        {
          "id": "setup-sprites-and-data",
          "kind": "setup",
          "title": "Create the Sprites, Backdrops, and Shared Data",
          "explanation": "Exact names make later menus and code easy to follow. Lives and Bricks Left decide whether play continues. The shared Hit Claimed variable makes sure only one Brick clone reacts when Ball touches the bricks. Messages let the Stage run setup in order and let sprites work together.",
          "instructions": [
            "Start a new Scratch project and delete the Cat.",
            "Add or paint four sprites and name them exactly Paddle, Ball, Brick, and Apple.",
            "Make Ball round and no wider than 20 pixels. Paint Paddle about 80 pixels wide and 10 pixels tall. Paint Brick about 40 pixels wide and 18 pixels tall.",
            "Create three Stage backdrops named Play, You Win, and Game Over. Keep the ending backdrops simple and readable.",
            "Make three variables for all sprites named Lives, Bricks Left, and Hit Claimed.",
            "Create six messages named Build Bricks, Start Ball, Hit Brick, Apple Caught, Win, and Game Over.",
            "Do not make a Restart sprite, Restart message, restart key, or Ball clone."
          ],
          "hints": [
            "Use the paint editor if a library sprite is too large or detailed.",
            "Variable and message names must include the spaces shown here.",
            "Keep Ball no wider than 20 pixels. A bigger Ball touches the bottom edge and bounces before the miss check can see it."
          ],
          "debuggingTips": [
            {
              "symptom": "A sprite or variable does not appear in a block menu.",
              "checks": [
                "Check its spelling and capitalization.",
                "Confirm Lives, Bricks Left, and Hit Claimed were made for all sprites, not for one sprite only."
              ]
            }
          ],
          "checkpoint": {
            "task": "Check the sprite list, backdrop list, Variables category, and message menus.",
            "expectedResult": "The project contains only the four required sprites, three named backdrops, three shared variables, and six named messages.",
            "completeWhen": [
              "All sprite, backdrop, variable, and message names match the instructions exactly.",
              "There is no restart control.",
              "Ball has no clones or clone-making script."
            ]
          }
        },
        {
          "id": "build-stage-and-paddle",
          "kind": "build",
          "title": "Set Up the Game and Control the Paddle",
          "explanation": "The Stage sets the starting values because they belong to the whole game. It resets all three shared variables, tells Brick to build the grid, waits for that to finish, and only then tells Ball to start. Paddle follows only mouse x, so it moves sideways but stays at the same height near the bottom.",
          "instructions": [
            "On the Stage, add a green-flag script that switches to Play, sets Lives to 3, sets Bricks Left to 50, and sets Hit Claimed to 0.",
            "Next, broadcast Build Bricks and wait. After that block, broadcast Start Ball without adding a wait.",